{
  "schemaVersion": 1,
  "id": "M0-009-VerifiedMacAotAndNativeLink",
  "milestone": "M0",
  "status": "passed",
  "timestampUtc": "2026-10-17T16:10:50Z",
  "repositoryRevision": "6ba350fec265bc9a1c8c1f663d43aae73b447b84",
  "toolchainLockSha256": "a7c14e9ddba4dd11bfd0e01feecfad129a789f16bd5b1acbdd6828f8bd16a6f5",
  "expectedBehavior": "A profile-selected Mac HelloIos build reaches the active-stack Mono AOT compiler and native link, retaining a private binlog for offline verification.",
  "observedBehavior": "The explicit SDK 10.0.402 Mac capture completed HelloIos for net10.0-ios/ios-arm64/Release with exit code 0. Sidecar hashes verified. The private binlog records mono-aot-cross compilation of HelloIos.dll for arm64-ios, generated assembly/object/AOT-data outputs, an executed clang++ native-link command containing the AOT objects, and linker output. AotProbe also built successfully, but only as a managed class library and therefore provides no AOT or device-execution evidence.",
  "limitations": [
    "The captured worktree was dirty and no global.json governed SDK selection, so this capture is not a canonical reproducible source snapshot.",
    "The final .app, Mach-O inspection, and independent codesign verification were not retained with the private capture.",
    "This is Mac reference evidence only; it does not prove the Linux-hosted compiler, Linux workload-manifest strategy, device installation, or device execution.",
    "Raw reports and binlogs contain sensitive operational metadata and remain ignored, owner-private artifacts."
  ],
  "nextDecision": "Preserve the Mac reference result as an AOT/native-link baseline, then continue M0/M1 with the disposable Linux workload-manifest graph and Linux compiler feasibility. Capture final-app architecture and signature verification separately before any signing or deployment claim.",
  "commands": [
    {
      "command": "SHA-256 verify all supplied private report, inventory, and binlog sidecars from the new HelloIos and AotProbe captures.",
      "exitCode": 0
    },
    {
      "command": "Offline-decompress and inspect the private HelloIos binary log for AOT compiler output, target options, native-link command, and linker output; do not export the decoded log.",
      "exitCode": 0
    }
  ],
  "artifacts": [
    {
      "reference": "macios-references/HelloIos/HelloIos-reference.binlog (local-only, ignored)",
      "sha256": "46d693061d6a0b5dd25f7d1fc8ed8b785811eca6da91364b915297ede1d69aeb"
    },
    {
      "reference": "macios-references/HelloIos/mac-reference.txt (local-only, ignored)",
      "sha256": "967e4454bad18d381460f287d1846a59880237a567eaa03ac92c6d9585023a33"
    },
    {
      "reference": "macios-references/AotProbe/AotProbe-reference.binlog (local-only, ignored)",
      "sha256": "f5efe10d8a73160f8372bcd43ccd9e6cbd0de6e5c38b9f308fe85b6118ba4bc6"
    },
    {
      "reference": "macios-references/AotProbe/mac-reference.txt (local-only, ignored)",
      "sha256": "2735290b17268b8c4d7aa2a565e793a58ae2045863f594704e1ea9da37104c49"
    },
    {
      "reference": "macios-references/{HelloIos,AotProbe}/sdk-manifest-files.txt (local-only, ignored; identical captures)",
      "sha256": "40ae1f2b80548af31272c31e4844602d79ae875abd8a8dcde75d02db60cb383f"
    },
    {
      "reference": "macios-references/{HelloIos,AotProbe}/pack-directories.txt (local-only, ignored; identical captures)",
      "sha256": "cc9df5b31b6b01f45fd3aaabb431a2f3027d1a7e451da8b9bef0917df2622f4b"
    }
  ],
  "redaction": {
    "performed": true,
    "excluded": [
      "host, user, and filesystem-path data",
      "signing identities, profile selectors, profile identifiers, and entitlement metadata",
      "raw binlogs, project imports, environment records, and diagnostic output",
      "Apple SDK assets, credentials, and device records"
    ]
  }
}
