{
  "schemaVersion": 1,
  "id": "M0-008-ExplicitMacCaptureResults",
  "milestone": "M0",
  "status": "blocked",
  "timestampUtc": "2026-10-17T14:47:27Z",
  "repositoryRevision": null,
  "toolchainLockSha256": "a7c14e9ddba4dd11bfd0e01feecfad129a789f16bd5b1acbdd6828f8bd16a6f5",
  "expectedBehavior": "Use an explicit Mac dotnet executable to capture the active reference stack and build the HelloIos and AotProbe fixtures.",
  "observedBehavior": "Both reports identify /usr/local/share/dotnet as the selected 10.0.402 SDK root, workload set 10.0.401.1, macios 27.0.10722, and Xcode/iPhoneOS 27.0. HelloIos failed at provisioning-profile discovery before AOT, native linking, or app-bundle output. AotProbe built successfully but emitted only managed AotProbe.dll because it is a class library.",
  "limitations": [
    "No profile was available to HelloIos, so the capture does not prove signing, AOT execution, native linking, bundle creation, installation, or device execution.",
    "The source capture used a relative binary-log path after changing to the project directory. The reports name project-local binlog paths, but no binlogs were supplied with the capture directories.",
    "No global.json governed the captured build, and no repository revision or source-file hashes were captured.",
    "Report and inventory files are local-only ignored artifacts because they contain host and user-path information."
  ],
  "nextDecision": "Re-run HelloIos with the hardened capture script and an available local profile selected either by private project configuration or a redacted -p:CodesignProvision selector. Retain the private binlog and record only its hash in a new sanitized receipt.",
  "commands": [
    {
      "command": "Read and SHA-256 verify supplied local-only HelloIos and AotProbe Mac reports and their inventory files.",
      "exitCode": 0
    },
    {
      "command": "Inspect the supplied report build outcomes and the fixture project types without executing a build.",
      "exitCode": 0
    }
  ],
  "artifacts": [
    {
      "reference": "macios-references/HelloIos/mac-reference.txt (local-only, ignored)",
      "sha256": "30a70210f2a5b94b919175d26e239dbd0d156f94048ab0deba9f14fda9ab9f46"
    },
    {
      "reference": "macios-references/AotProbe/mac-reference.txt (local-only, ignored)",
      "sha256": "5d1301d0988fcdb70c4a96f97a20bf032fa25ef6617622a34825d9f67e0fd162"
    },
    {
      "reference": "macios-references/{HelloIos,AotProbe}/sdk-manifest-files.txt (local-only, ignored; identical captures)",
      "sha256": "40ae1f2b80548af31272c31e4844602d79ae875abd8a8dcde75d02db60cb383f"
    },
    {
      "reference": "macios-references/{HelloIos,AotProbe}/pack-directories.txt (local-only, ignored; identical captures)",
      "sha256": "cc9df5b31b6b01f45fd3aaabb431a2f3027d1a7e451da8b9bef0917df2622f4b"
    }
  ],
  "redaction": {
    "performed": true,
    "excluded": [
      "Mac hostname and user paths",
      "profile selectors, profile files, credentials, and signing identities",
      "raw binlogs and diagnostic output",
      "Apple SDK files and device records"
    ]
  }
}
