{
  "schemaVersion": 1,
  "id": "M0-005-RebaselinedMacReference",
  "milestone": "M0",
  "status": "blocked",
  "timestampUtc": "2026-10-17T13:58:18Z",
  "repositoryRevision": null,
  "toolchainLockSha256": "a7c14e9ddba4dd11bfd0e01feecfad129a789f16bd5b1acbdd6828f8bd16a6f5",
  "expectedBehavior": "Establish a Mac reference for the active 10.0.402 / 27.0 baseline and capture the actual AOT invocation.",
  "observedBehavior": "The supplied Mac uses SDK 10.0.402, workload set 10.0.401.1, iOS manifest 27.0.10722, and Xcode/iPhoneOS 27.0. Restore completed, but the build stopped at provisioning-profile discovery. The binlog evaluates the macOS-hosted AOT compiler pack path but does not prove compiler execution.",
  "limitations": [
    "The source capture invoked ambient dotnet and recorded an executable path as dotnet_root.",
    "No global.json governed the source capture.",
    "No executed AOT command, output object, native link, bundle, or signing evidence is available.",
    "Raw report and binlog are ignored local artifacts because they contain host and user-path information."
  ],
  "nextDecision": "Re-run the corrected capture script with an explicit dotnet executable, a clean project directory, and a valid development profile or an evidenced unsigned path that reaches AOT.",
  "commands": [
    {
      "command": "Verify supplied mac-reference.txt and helloios-reference.binlog SHA-256 values; inspect decompressed binlog strings read-only.",
      "exitCode": 0
    }
  ],
  "artifacts": [
    {
      "reference": "macios-references/mac-reference.txt (local-only, ignored)",
      "sha256": "ac3b139e1f3fd0706e3781867da562b0df1a0ccca698c13c52bf6114200c802d"
    },
    {
      "reference": "macios-references/helloios-reference.binlog (local-only, ignored)",
      "sha256": "0c7db97cf77264b0465825a63c4c5e58cd4bcb086f6bd3c5c73d922563dbcdb7"
    }
  ],
  "redaction": {
    "performed": true,
    "excluded": [
      "Mac hostname",
      "user paths",
      "provisioning data",
      "raw binlog content"
    ]
  }
}
