{
  "schemaVersion": 1,
  "id": "M0-004-OfficialManifestInspection",
  "milestone": "M0",
  "status": "passed",
  "timestampUtc": "2026-10-17T11:21:32Z",
  "repositoryRevision": null,
  "toolchainLockSha256": "e647355a38ec868caca79f764ff38f13e944df53f47026689b4c0bec06c4ee4f",
  "expectedBehavior": "Inspect the workload-set and official iOS manifest packages without installing them to identify the actual manifest package, workload ID, pack graph, and host aliases.",
  "observedBehavior": "The workload set maps Microsoft.NET.Sdk.iOS to 26.5.10301/10.0.100. Microsoft.NET.Sdk.iOS.Manifest-10.0.100 26.5.10301 exposes workload ID ios and Windows SDK aliases only; no Linux host mapping was observed.",
  "limitations": [
    "Package inspection does not establish resolver precedence or lifecycle behavior.",
    "The package graph includes transitive runtime/toolchain work not yet inventoried.",
    "No project-owned manifest has been generated or installed."
  ],
  "nextDecision": "M1 must test whether a distinct project manifest can coexist with this official ios definition; otherwise evaluate a managed replacement under an ADR.",
  "commands": [
    {
      "command": "Download and inspect Microsoft.NET.Workloads.10.0.300 10.302.0 and Microsoft.NET.Sdk.iOS.Manifest-10.0.100 26.5.10301 with unzip",
      "exitCode": 0
    }
  ],
  "artifacts": [
    {
      "reference": "/tmp/opencode/dotnet-ios-linux-m0/package-metadata/workload-set.nupkg",
      "sha256": "ab6ac0281adf6a9c12eca7ccd5832b681c7cc94fd097fd898d1284503508e33d"
    },
    {
      "reference": "/tmp/opencode/dotnet-ios-linux-m0/package-metadata/microsoft.net.sdk.ios.manifest-10.0.100.26.5.10301.nupkg",
      "sha256": "724eebc1ee1e896cd6ae29fdb6e97a7faf03603ed5eedde0102831e3c0aa94a2"
    }
  ],
  "redaction": {
    "performed": true,
    "excluded": [
      "Apple SDK content",
      "credentials",
      "device records"
    ]
  }
}
